{
  "schema_version": "0.2",
  "analysis_id": "A4_conf02_m1",
  "candidate": "A4",
  "sequence": "SPSNFITMYDW",
  "group": "A",
  "conformer": "conf02",
  "model": 1,
  "docking_output_path": "docking_test/vina_pilot_20260906/outputs/A4_conf02_out.pdbqt",
  "pose_metrics_path": "docking_test/vina_pilot_20260906/analysis/A4_conf02_pose_metrics.tsv",
  "receptor_monomer_path": "GPT_vina_branch_20260906/receptor_pdb/h26d3_af3_s2718_m2_TfR1_A.pdb",
  "receptor_dimer_path": "GPT_vina_branch_20260906/receptor_dimer/h26d3_af3_s2718_m2_TfR1_AB.pdb",
  "receptor_chain": "A",
  "target_residues": [150, 151, 154, 158, 159, 160, 161, 163, 385],
  "direct_contact_cutoff_A": 4.0,
  "near_contact_cutoff_A": 5.0,
  "manual_interactions": [
    {
      "interaction_id": "Trp11-Gln160",
      "labels": {
        "ligand_residue": "TRP11",
        "ligand_atom": "NE1",
        "receptor_residue": "GLN160"
      },
      "distance": {
        "ligand_atom_id": 108,
        "receptor_residue": 160,
        "receptor_atom": "OE1"
      },
      "angle": {
        "ligand_donor_atom_id": 108,
        "ligand_hydrogen_atom_id": 114,
        "receptor_acceptor": {"residue": 160, "atom": "OE1"}
      },
      "interpretation": "geometrically plausible hydrogen bond",
      "interpretation_source": "manual_golden_reference"
    },
    {
      "interaction_id": "Asp10-Asn150",
      "labels": {
        "ligand_residue": "ASP10",
        "ligand_atom": "O",
        "receptor_residue": "ASN150"
      },
      "distance": {
        "ligand_atom_id": 102,
        "receptor_residue": 150,
        "receptor_atom": "OD1"
      },
      "angle": {
        "ligand_donor_atom_id": 102,
        "ligand_hydrogen_atom_id": 103,
        "receptor_acceptor": {"residue": 150, "atom": "OD1"}
      },
      "interpretation": "close contact; geometry does not support conventional hydrogen bond",
      "interpretation_source": "manual_golden_reference"
    },
    {
      "interaction_id": "Asp10-Lys161",
      "labels": {
        "ligand_residue": "ASP10",
        "ligand_atom": "O",
        "receptor_residue": "LYS161"
      },
      "distance": {
        "ligand_atom_id": 102,
        "receptor_residue": 161,
        "receptor_atom": "NZ"
      },
      "angle": null,
      "interpretation": "close polar contact; do not call salt bridge because protonation state is not standardized",
      "interpretation_source": "manual_golden_reference"
    }
  ],
  "input_sha256": {
    "docking_output_path": "94e0666acd0a46557f3487eca85da03dc8a833298cb9a245a9349c904bb51850",
    "pose_metrics_path": "50a0622763473ad255ebe9f298e8981fd98d909634b70ba218a2057237e9b836",
    "receptor_monomer_path": "fdc9398d178ebbcd1cd8d33446ca31236e86a7ffa1a413d35281151968ee2bc4",
    "receptor_dimer_path": "dd7e1b1eaa1be2fa2dca88da8f51edb2915d1a02891cfa4362f72c6d70c7ed27"
  }
}
